{
  "accountCorrelationId": "22c39541-e8e0-45b3-af99-532b33646b69",
  "caseReferences": "SJ914887739",
  "dateDecisionMade": "2026-01-20",
  "defendantAddress": "FLAT - 25A Constable Street Bristol England UK IG1 1YY",
  "defendantContactNumber": "01231231230",
  "defendantDateOfBirth": "2000-01-01",
  "defendantEmail": "Flmaq4DcSmithHaean@email.com",
  "defendantName": "Flmaq4Dc SmithHaean",
  "divisionCode": "77",
  "hearingCourtCentreName": "Lavender Hill Magistrates' Court",
  "hearingSittingDay": "2026-01-20",
  "id": "1af48e5d-c6f0-4d79-868f-485e214c21e7",
  "impositionOffenceDetails": [
    {
      "details": "A - Adjournment\nAdjourned for hearing on 20/01/2026 at 22:30 in Courtroom 01, Bexley Magistrates' Court. Reason: To attend or a warrant to issue. Defendant to attend the next hearing.\nTo attend or a warrant to issue\nhearing on 20/01/2026 at 22:30 in Courtroom 01, Bexley Magistrates' Court",
      "offenceDate": "2019-11-28",
      "offenceId": "fc813bf3-d073-4f58-b113-0ffaf7d08fd4",
      "title": "Keep a vehicle without a valid vehicle licence"
    }
  ],
  "isFinancialPenaltiesWrittenOff": "false",
  "isSJPHearing": false,
  "masterDefendantId": "34431e2d-7a41-4130-bc5f-4efa7d2d7635",
  "newApplicationResults": {
    "applicationResult": []
  },
  "newOffenceByResult": [],
  "oldAccountCorrelationId": "d39a8389-0bd5-40af-8985-260e13c18e05",
  "oldDivisionCode": "77",
  "originalDateOfOffence": "2021-21-21",
  "originalDateOfSentence": "2021-21-21",
  "sendTo": "LCCCCancellations@Justice.gov.uk",
  "subject": "APPLICATION TO REOPEN GRANTED"
}